id,question
106,What are some common mistakes to avoid when performing the T-Bar Row to maximize effectiveness and minimize risk of injury?
107,How many sets and reps of Bulgarian Deadlifts should I do for optimal hamstring growth?
107,What is the proper foot placement and stance width for effective Bulgarian Deadlifts with dumbbells?
107,Should I focus on a slow eccentric movement or a fast concentric movement during the Bulgarian Deadlift exercise?
107,"Can I substitute the dumbbells with a barbell for the Bulgarian Deadlift, and if so, how would the technique change?"
107,I feel strain in my knees during Bulgarian Deadlifts; how can I adjust my form to alleviate this?
108,How many repetitions should I aim for on each leg during a pistol squat workout?
108,What are some modifications for pistol squats if I can't go all the way down to parallel?
108,Is it okay to slightly bend my supporting leg during the pistol squat to maintain balance?
108,Should I focus on controlling the descent or the ascent more during the pistol squat?
108,What are the potential risks or injuries associated with performing pistol squats and how can I mitigate them?
109,How many sets and reps of seated leg curls should I do to build hamstring strength?
109,What is the proper form to avoid knee pain while performing seated leg curls?
109,"Should I use a slow, controlled tempo or a faster tempo for seated leg curls?"
109,Is it okay to use a heavier weight even if I can only complete fewer reps?
109,What are some variations to the standard seated leg curl exercise to target different parts of my hamstrings?
110,How many repetitions and sets of Russian Kettlebell Swings are recommended for building strength?
110,Should my back be straight throughout the entire Russian Kettlebell Swing movement to avoid injury?
110,What is the proper grip technique for holding the kettlebell during Russian Kettlebell Swings to maximize effectiveness and prevent dropping?
110,At what height should I bring the kettlebell up during the upward swing of the Russian Kettlebell Swing?
110,"Is it necessary to use a specific weight kettlebell when starting with Russian Kettlebell Swings, or can I use any weight?"
111,How many sets and reps of Incline Dumbbell Curls do you recommend for building bicep size?
111,What is the optimal incline angle for maximizing biceps activation during Incline Dumbbell Curls?
111,"Should I use a supinated, semi-supinated, or neutral grip for Incline Dumbbell Curls to best target my biceps?"
111,Can I substitute the dumbbells with another piece of equipment for the Incline Dumbbell Curl?
111,"How can I modify the Incline Dumbbell Curl to make it easier if I am a beginner, and how would I progress it to make it more challenging?"
112,How many decline sit-ups should I aim for in a set to effectively work my rectus abdominis?
112,What is the ideal angle of the decline bench for optimal engagement of my hip flexors during decline sit-ups?
112,"Should I keep my hands clasped behind my head, straight out in front of me, or crossed over my chest during the decline sit-up?"
112,"To avoid straining my lower back during decline sit-ups, what adjustments to form should I make?"
112,"Besides the decline bench, are there any alternative surfaces or setups I can use for this exercise if I don't have a decline bench?"
113,How many repetitions of Side Plank Dips should I aim for during each set?
113,What modifications can I make to the Side Plank Dip if I find the full exercise too challenging?
113,Should I hold my breath during the lowering or lifting phase of a Side Plank Dip?
113,How can I ensure proper form and alignment during a Side Plank Dip to avoid injury?
113,"Besides Obliques and Shoulders, what other muscles are significantly engaged during this Side Plank Dip exercise?"
114,How many repetitions and sets of Single Arm Kettlebell Swings should I perform for optimal results?
114,Should my back remain straight throughout the entire Single Arm Kettlebell Swing motion?
114,What is the ideal weight of the kettlebell for a beginner performing Single Arm Kettlebell Swings?
114,"To avoid injury during Single Arm Kettlebell Swings, how important is maintaining a controlled movement and proper form?"
114,Can I adapt the Single Arm Kettlebell Swing to target specific muscles like glutes or hamstrings more effectively?
115,How many jumping squats should I do for a good lower body workout?
115,Should I land with bent knees to reduce impact during jumping squats?
115,Is it okay if I modify the jumping squats by stepping instead of jumping for my lower body workout?
115,What is the proper form to maintain throughout the entire movement of a jumping squat to maximize results and minimize risk of injury?
115,"Besides quadriceps, glutes, and calves, what other muscles are subtly engaged during jumping squats?"
116,How many sets and reps of Cable Chest Fly are recommended for building chest muscle mass?
116,What is the proper grip width to use when performing Cable Chest Fly for optimal pectoral activation?
116,Should I use a slow controlled movement or a faster pace during the Cable Chest Fly exercise?
116,Can I modify the Cable Chest Fly exercise if I have shoulder impingement issues?
116,What is the difference between performing Cable Chest Fly with a close grip versus a wide grip?
117,How many sets and reps of Dumbbell Tricep Extensions should I do for optimal triceps growth?
117,What is the proper form to avoid injuring my elbows during Dumbbell Tricep Extensions?
117,Can I substitute the dumbbells with another type of equipment for Dumbbell Tricep Extensions?
117,Should I use a heavier dumbbell or focus on controlled movements for Dumbbell Tricep Extensions?
117,What are some variations of the Dumbbell Tricep Extension exercise to target different parts of my triceps?
118,How many sets and reps of leg curls should I do for optimal hamstring growth?
118,What is the proper form to avoid knee strain during leg curls?
118,Should I use a slow and controlled tempo or fast movements for the leg curl exercise?
118,Is there a variation of the leg curl that targets the lower or upper hamstrings more specifically?
118,Can I substitute another exercise if I don't have access to a leg curl machine?
119,How many repetitions should I aim for on each arm to see optimal results for building upper body strength?
119,"Should I keep my hips level throughout the entire movement, and if not, how much rotation is acceptable?"
119,What modifications can I make to the One-Arm Push-Up if I find the full version too difficult?
119,"Does the hand placement on the floor significantly affect the muscles worked, and if so, how?"
119,"Besides strength building, what other fitness benefits can I expect from consistently performing One-Arm Push-Ups?"
120,How many sets and reps of Machine Shoulder Press are recommended for building shoulder mass?
120,What is the proper grip width to use on the Machine Shoulder Press to maximize activation of the deltoids?
120,Should I adjust the seat height on the Machine Shoulder Press to ensure proper form and prevent injury?
120,What modifications can I make to the Machine Shoulder Press if I experience shoulder pain during the exercise?
120,Is it possible to use different grips or handle positions on the Machine Shoulder Press to target specific heads of the deltoids?
121,How wide should my feet be apart when performing a Sumo Squat to maximize glute activation?
121,"Should my knees track over my toes during the Sumo Squat descent, or is it acceptable for them to point outwards slightly?"
121,What is the correct depth I should achieve in a Sumo Squat; should my thighs be parallel to the floor or lower?
121,"If I find Sumo Squats challenging on my knees, are there any modifications I can make to reduce strain?"
121,"Besides the Quadriceps, Glutes, and Hamstrings, are there any other secondary muscle groups significantly engaged during a Sumo Squat?"
122,How many sets and repetitions of Resistance Band Squats are recommended for building lower body strength?
122,"Should I choose a light, medium, or heavy resistance band for Resistance Band Squats, and how does that impact the workout?"
122,What is the proper form and technique for performing a Resistance Band Squat to maximize muscle activation and prevent injuries?
122,Can I modify the Resistance Band Squat exercise if I have knee problems or limited mobility?
122,"Besides building strength, what other benefits can I expect from incorporating Resistance Band Squats into my workout routine?"
123,How many repetitions should I aim for on each leg during a One-Legged Squat workout?
123,Is it okay if my extended leg isn't perfectly straight during the One-Legged Squat?
123,Should I be focusing on keeping my knee aligned with my ankle in the One-Legged Squat to avoid injury?
123,What modifications can I make to the One-Legged Squat if I find it too challenging?
123,Can I use a chair or wall for balance assistance while performing One-Legged Squats?
124,How many sets and reps of Landmine Rows should I do for optimal muscle growth?
124,"What is the proper form to avoid injury while performing Landmine Rows, particularly concerning back posture?"
124,Can I modify the Landmine Row exercise if I don't have access to a landmine attachment?
124,"Besides the Latissimus Dorsi and Biceps, what other muscles are significantly engaged during Landmine Rows?"
124,Should I use a heavier weight for fewer reps or a lighter weight for more reps with Landmine Rows?
125,How many repetitions and sets of Superman exercises are recommended for a beginner?
125,Should my arms and legs be fully extended during the lift in a Superman exercise?
125,What modifications can I make to the Superman exercise if I have lower back pain?
125,Is it okay to slightly bend my knees during the Superman exercise if I find it too difficult to keep them straight?
125,"Besides strengthening my lower back, glutes, and hamstrings, what other benefits can I expect from performing the Superman exercise regularly?"
126,How many sets and reps of dumbbell flyes should I do for optimal chest growth?
126,"Should I use a flat, incline, or decline bench for dumbbell flyes, and how does the angle change the muscle activation?"
126,What is the proper dumbbell weight to use for dumbbell flyes to ensure good form and avoid injury?
126,"During dumbbell flyes, should I pause at the bottom of the movement or keep it fluid?"
126,"What are some common mistakes to avoid when performing dumbbell flyes, and how can I correct them?"
127,How many sets and reps of reverse flys should I do for optimal rear delt growth?
127,Should my elbows be slightly bent or locked during the reverse fly exercise?
127,What is the proper dumbbell weight to use for reverse flys while maintaining good form?
127,Is it okay to use a slight momentum to help lift the dumbbells during the reverse fly exercise?
127,What are some common mistakes to avoid when performing the reverse fly exercise to prevent injury?
128,How many sets and repetitions of cable kickbacks are recommended for building glute strength?
128,Should I keep my core engaged throughout the entire cable kickback movement to maintain proper form?
128,"What is the ideal weight or resistance level to use for cable kickbacks, and how can I adjust it based on my fitness level?"
128,"If I feel discomfort in my lower back during cable kickbacks, what modifications or alternative exercises could I consider?"
128,"Is it okay to perform cable kickbacks if I have previously sustained a knee injury, and if so, what precautions should I take?"
129,How many reps and sets of Kettlebell Push Press are recommended for building upper body strength?
129,Should I use a lighter kettlebell to focus on proper form before increasing weight for Kettlebell Push Press?
129,What is the correct hand position when holding the kettlebell for the Kettlebell Push Press exercise?
129,Does leg drive play a significant role in executing a Kettlebell Push Press effectively and safely?
129,Are there any variations of the Kettlebell Push Press suitable for beginners or those with limited shoulder mobility?
130,How do I ensure my back remains flat throughout the Dead Bug exercise?
130,Should my arms and legs touch the floor during the Dead Bug exercise?
130,What modifications can I make to the Dead Bug if I experience lower back pain?
130,Is it okay to pause briefly during the lowering phase of the Dead Bug?
130,How many repetitions and sets of Dead Bugs are recommended for a beginner?
131,How many sets and reps of Smith Machine Squats should I do for optimal muscle growth?
131,What is the proper foot placement and stance width for Smith Machine Squats to maximize quadriceps activation?
131,"Should I use a spotter when performing Smith Machine Squats, and if so, how should they assist?"
131,"Is it necessary to go parallel with my thighs to the floor for the Smith Machine Squat, or is it beneficial to do partial reps?"
131,What are some common mistakes to avoid when performing Smith Machine Squats to prevent injury?
132,How many repetitions and sets of Reverse Hyperextensions should I do for optimal glute activation?
132,What is the proper form to avoid lower back strain during Reverse Hyperextensions?
132,Can I modify the Reverse Hyperextension machine settings to make the exercise easier or more challenging?
132,"Is it possible to perform Reverse Hyperextensions with bodyweight only, if I don't have access to a machine?"
132,"Besides glutes, hamstrings, and lower back, which other muscles are significantly involved in Reverse Hyperextensions?"
133,How many repetitions and sets of Landmine Twists are recommended for building core strength?
133,What is the ideal weight to use for Landmine Twists to effectively engage my obliques without causing injury?
133,"Should I maintain a slow, controlled movement or a faster pace during the side-to-side rotation in Landmine Twists?"
133,"Can I modify the Landmine Twist exercise if I lack access to a landmine attachment, and if so how?"
133,What are some common mistakes to avoid while performing Landmine Twists to maximize effectiveness and prevent strain?
134,How many sets and repetitions of machine rows are recommended for building upper body strength?
134,Should I keep my back straight and core engaged throughout the entire machine row movement?
134,What is the proper grip width and hand position when using the handles of the machine row?
134,At what point in the machine row exercise should I exhale and inhale for optimal breathing technique?
134,Is there a variation of the machine row that targets the biceps more specifically?
135,How many repetitions and sets should I do for optimal calf growth using the Seated Calf Raise machine?
135,What is the proper foot placement on the platform of the Seated Calf Raise machine to maximize muscle activation?
135,Should I use a slow and controlled movement or a faster tempo during the Seated Calf Raise exercise?
135,Is it necessary to lock out my knees completely at the top of the Seated Calf Raise movement?
135,Can I substitute this machine exercise with a bodyweight alternative to work the same muscles?
136,How many repetitions should I do on each side for optimal core engagement during Kettlebell Windmills?
136,What is the proper grip and hand placement on the kettlebell for the Kettlebell Windmill exercise?
136,Should my back remain straight or slightly arched during the torso bend in a Kettlebell Windmill?
136,"To prevent injury, what range of motion should my torso reach during the Kettlebell Windmill exercise?"
136,How can I modify the Kettlebell Windmill exercise to reduce the strain on my lower back?
137,What is the optimal incline angle for the Incline Barbell Bench Press to maximize pectoral activation?
137,How can I ensure proper form to prevent injury during the Incline Barbell Bench Press?
137,What are some variations of the Incline Barbell Bench Press to target different parts of the pectorals?
137,"Should I focus on a controlled tempo during the lowering phase of the Incline Barbell Bench Press, and if so what is the ideal tempo?"
137,How many sets and repetitions are recommended for the Incline Barbell Bench Press to promote muscle growth and strength?
138,How do I ensure my knees don't go past my toes during the Kettlebell Goblet Squat?
138,What is the ideal weight of the kettlebell for a beginner performing Kettlebell Goblet Squats?
138,Should my back remain straight throughout the entire movement of the Kettlebell Goblet Squat?
138,How many repetitions and sets are recommended for Kettlebell Goblet Squats to build strength effectively?
138,Is it okay to modify the Kettlebell Goblet Squat if I have limited mobility in my ankles or hips?
139,How many sets and reps of Dumbbell Thrusters are recommended for building strength?
139,Should my dumbbells be heavy enough to challenge me by the last rep of each set?
139,What is the proper form to avoid injuring my knees while squatting during Dumbbell Thrusters?
139,Can I substitute the dumbbells with kettlebells for this exercise?
139,"If I experience shoulder pain during the overhead press portion, how can I modify the exercise?"
140,How many sets and reps of Lying Leg Curls should I do for optimal hamstring growth?
140,What is the proper form to avoid injuring my knees during Lying Leg Curls?
140,Can I modify the Lying Leg Curl machine to accommodate my shorter legs?
140,Should I use a slow or fast tempo during the concentric and eccentric phases of a Lying Leg Curl?
140,"Is it okay to feel some lower back strain while doing Lying Leg Curls, or should I adjust my technique?"
141,How many sets and repetitions of Dumbbell Hammer Curls do you recommend for building biceps mass?
141,Should I adjust my grip width at all during the Dumbbell Hammer Curl exercise?
141,What is the proper way to control the dumbbells during the eccentric (lowering) phase of the Dumbbell Hammer Curl?
141,Are there any variations of the Dumbbell Hammer Curl that I can incorporate to target my forearms more effectively?
141,"If I don't have dumbbells, what alternative exercises can I do to target the same muscle groups?"
142,How many sets and reps of Landmine Squat Presses should I do for optimal muscle growth?
142,What is the proper foot placement for Landmine Squat Presses to maximize quadriceps activation?
142,Should I prioritize a controlled descent or explosive ascent during the squat portion of the Landmine Squat Press?
142,Can I substitute dumbbells or resistance bands if I don't have access to a landmine barbell setup?
142,Does the angle of the landmine affect the emphasis on different muscle groups during Landmine Squat Presses?
143,How many repetitions and sets of Zottman curls should I do for optimal bicep growth?
143,Should I use a heavier weight for the supinated portion of the Zottman curl or the pronated portion?
143,Is it okay to use a slightly lighter dumbbell for Zottman curls compared to standard bicep curls?
143,What is the best way to control the speed of the dumbbell during the pronated lowering phase of the Zottman curl?
143,Does the shoulder-width stance significantly impact the effectiveness of the Zottman curl exercise?
144,How far should my elbows go towards my knees during the Cable Crunch?
144,Should my lower back arch at all while performing a Cable Crunch?
144,What weight should I start with for Cable Crunches as a beginner?
144,Is it okay to use a straight bar attachment instead of the rope for Cable Crunches?
144,What is the correct kneeling stance and foot placement for optimal Cable Crunch execution?
145,How many repetitions should I aim for in a Stability Ball Pike set?
145,What modifications can I make to the Stability Ball Pike if I lack sufficient core strength?
145,Is it okay to slightly bend my knees during the Stability Ball Pike exercise?
145,Should my hips be completely straight while I'm in the pike position?
145,How can I make the Stability Ball Pike more challenging?
146,How many repetitions and sets of standing calf raises should I do for optimal calf development?
146,Should I hold the standing calf raise at the top of the movement for added benefit?
146,What is the proper foot placement and stance width for the standing calf raise to target the medial and lateral heads of the calves effectively?
146,"Is it necessary to use a raised surface for the standing calf raise, or can it be performed effectively on a flat surface?"
146,"Can I modify the standing calf raise to increase the difficulty, such as by adding weight or changing the range of motion?"
147,How many sets and reps of Cable Kickbacks should I do for optimal triceps growth?
147,"What is the proper form to avoid injury during Cable Kickbacks, particularly regarding elbow positioning?"
147,Can I modify the Cable Kickback exercise to reduce the strain on my elbows or wrists?
147,"Should I use a rope attachment or a straight bar handle for Cable Kickbacks, and why?"
147,"Besides triceps, what other muscles are slightly activated during this Cable Kickback exercise?"
148,How many reps and sets of Spider Push-Ups should I aim for as a beginner?
148,"Should I modify the Spider Push-Up if I have shoulder pain, and if so, how?"
148,What is the correct form to avoid injuring my lower back during Spider Push-Ups?
148,"Is it okay to do Spider Push-Ups every day, or should I incorporate rest days?"
148,Can I substitute another exercise for Spider Push-Ups if I lack the strength for a full high plank?
149,How many sets and repetitions of Resistance Band Chest Press are recommended for building muscle mass?
149,What is the ideal resistance band strength level for a beginner performing Resistance Band Chest Press?
149,"Should I focus on slow, controlled movements or faster reps during Resistance Band Chest Press?"
149,How can I modify the Resistance Band Chest Press exercise to reduce strain on my shoulders?
149,What are some common mistakes to avoid while performing Resistance Band Chest Press?
150,How many repetitions and sets should I do for optimal Latissimus Dorsi engagement during One-Arm Dumbbell Rows?
150,"What is the ideal dumbbell weight to start with for One-Arm Dumbbell Rows, considering I'm a beginner?"
150,"Should my back remain straight throughout the entire motion of the One-Arm Dumbbell Row, or is a slight curve acceptable?"
150,"To avoid injury, what is the proper technique for maintaining a stable and supported position on the bench during One-Arm Dumbbell Rows?"
150,"Besides the Latissimus Dorsi and Biceps, what other muscle groups are significantly activated during the One-Arm Dumbbell Row exercise?"
151,How many sets and reps of incline dumbbell chest press should I do for optimal muscle growth?
151,What incline degree on the bench is recommended for maximizing pectoral activation during incline dumbbell chest press?
151,"Should I use a weight that allows me to complete all reps with good form, or should I push for more weight even if my form suffers?"
151,"Is it necessary to pause at the bottom of each rep of incline dumbbell chest press, or can I use a continuous motion?"
151,What are some common mistakes to avoid during incline dumbbell chest press to prevent injuries?
152,How many sets and reps of Machine Preacher Curls do you recommend for building biceps mass?
152,What is the proper grip width to use on the Machine Preacher Curl handle for optimal bicep activation?
152,Should my elbows remain in constant contact with the preacher curl pad throughout the entire range of motion?
152,"Is it okay to use momentum to lift the weight during Machine Preacher Curls, or should the movement be controlled?"
152,Can I substitute another exercise if I don't have access to a preacher curl machine?
153,How many repetitions of hanging knee raises should I aim for in a set?
153,What is the proper form to avoid injury during hanging knee raises?
153,Can I modify hanging knee raises if I can't do a full hang?
153,What are some alternative exercises to target the same muscle groups if I cannot perform hanging knee raises?
153,"How long should I hold the knee raise at the top before lowering, and should the lowering be controlled?"
154,How many sets and reps of Decline Dumbbell Press should I do for optimal chest growth?
154,What is the proper form for the Decline Dumbbell Press to avoid shoulder injury?
154,Can I substitute Decline Dumbbell Press with another exercise targeting the same muscle groups if I don't have access to a decline bench?
154,Should I use a heavier weight for the Decline Dumbbell Press if I'm focusing on strength or a lighter weight if I'm focusing on hypertrophy?
154,What are some common mistakes to avoid when performing the Decline Dumbbell Press?
155,How many repetitions should I aim for on each leg to maximize glute activation during Glute Kickbacks?
155,"Should I keep my back perfectly straight throughout the entire Glute Kickback exercise, or is a slight curve acceptable?"
155,What is the ideal tempo for performing Glute Kickbacks to optimize muscle engagement and minimize injury risk?
155,"During Glute Kickbacks, should I focus on a slow and controlled movement or a faster, more explosive movement?"
155,"Besides glutes and hamstrings, are there any other muscles significantly engaged during the Glute Kickback exercise?"
156,How many sets and reps of Machine Chest Press should I do for optimal muscle growth?
156,"What is the proper grip width to use on the Machine Chest Press handles to target my upper, middle, and lower pecs effectively?"
156,"Should I inhale while lowering the weight or while pressing it during Machine Chest Press, and why?"
156,What are some common mistakes to avoid when performing the Machine Chest Press to prevent injury and maximize results?
156,"If I don't have access to a Machine Chest Press, what are some suitable alternative exercises to target the same muscle groups?"
