id,question
0,How many sets and repetitions of push-ups are recommended for building upper body strength?
0,Should my elbows be tucked in close to my body or flared out during push-ups?
0,What modifications can I make to the push-up if I'm unable to perform a standard push-up?
0,Does the position of my hands affect which muscles are primarily worked during a push-up?
0,"Are there variations of push-ups that target specific muscle groups within the chest, triceps, and shoulders?"
1,How many reps and sets of squats should I do for optimal muscle growth?
1,"Should my knees go past my toes during the squat, and if not, why?"
1,What are some common mistakes to avoid when performing squats to prevent injury?
1,Is it better to do squats with a narrow or wide stance for targeting different muscle groups?
1,"Can I modify the standard squat if I have knee problems, and how?"
2,How far apart should my elbows be positioned during a forearm plank?
2,Should my hips be higher or lower than my shoulders while holding the plank position?
2,What modifications can I make to the plank if I can't hold the full position?
2,"How long should I hold a plank for optimal results, and how many repetitions should I aim for?"
2,Are there variations of the plank exercise that target different core muscles?
3,How do I adjust my grip width on the barbell for optimal deadlift form?
3,What are some common mistakes to avoid during the deadlift to prevent injury?
3,Should my back remain straight or slightly arched during the lifting phase of the deadlift?
3,"Is it okay to use straps to assist with the deadlift, and if so, when should I use them?"
3,How can I progressively overload my deadlift to continue to see gains in strength?
4,How many sets and reps of bicep curls should I do for optimal muscle growth?
4,Should I use a supinated or neutral grip during the bicep curl exercise?
4,What is the proper form to maintain during bicep curls to prevent injury and maximize effectiveness?
4,Is it okay to slightly move my elbows during a bicep curl or should they remain completely stationary?
4,"Besides dumbbells, what other equipment could I use to perform bicep curls?"
5,How wide should my feet be positioned during the Kettlebell Swing?
5,What is the correct hip drive technique for an effective swing?
5,Should my back remain straight or arched throughout the Kettlebell Swing movement?
5,At what height should I bring the kettlebell during the upward swing?
5,How can I modify the Kettlebell Swing to reduce stress on my lower back?
6,How many sets and reps of shoulder presses should I do for optimal muscle growth?
6,"What is the proper dumbbell weight I should start with for shoulder presses, considering I'm a beginner?"
6,Should my elbows be slightly bent or locked out at the top of the shoulder press movement?
6,"To avoid injury, what is the correct posture and form I should maintain during the shoulder press?"
6,"Besides dumbbells, can I perform this exercise using other equipment like a barbell or resistance band?"
7,How wide should my grip be on the bar for optimal Latissimus Dorsi activation during the Lat Pulldown?
7,"What is the recommended range of motion for a proper Lat Pulldown, ensuring full muscle engagement?"
7,"Should I focus on a controlled, slow descent or a more explosive pull-down during the Lat Pulldown exercise?"
7,"Is it okay to slightly arch my back during the Lat Pulldown to improve form and range of motion, or should I keep it straight?"
7,What are some common mistakes to avoid while performing the Lat Pulldown to prevent injury and maximize results?
8,How high should the bench or step be for optimal hamstring stretch during this exercise?
8,Should I keep my back straight or slightly arched while leaning forward in the Hamstring Stretch?
8,What is the recommended hold time for each stretch during the Hamstring Stretch exercise?
8,"If I feel the stretch more in my calf than my hamstring, what adjustments can I make to the Hamstring Stretch?"
8,"Besides a bench or step, are there any alternative surfaces I can use to perform the Hamstring Stretch exercise?"
9,How many jumping jacks should I do for an effective warm-up?
9,Should I modify the jumping jacks if I have knee problems?
9,What is the proper form to avoid injury while performing jumping jacks?
9,Can I incorporate jumping jacks into a high-intensity interval training (HIIT) workout?
9,Are there variations of jumping jacks to target specific muscle groups more effectively?
10,How many sets and reps of bench press should I do for optimal muscle growth?
10,What is the proper grip width for the barbell during a bench press to target my chest effectively?
10,"Should I use a spotter when performing heavy bench presses, and if so, why?"
10,What are some common mistakes to avoid when executing a bench press to prevent injuries?
10,"Besides pectorals, triceps, and deltoids, what other muscles are involved in the bench press, even if less prominently?"
11,How far forward should my front foot be placed when performing a lunge?
11,"Should my front knee go past my toes during the lunge movement, and why?"
11,What is the proper way to maintain balance while doing lunges?
11,"Besides the quadriceps, glutes, and hamstrings, what other muscles are also engaged during lunges, even if minimally?"
11,"If I find standard lunges too difficult, are there any modifications or easier variations I can do to still benefit from the exercise?"
12,How many pull-ups should I aim for as a beginner?
12,What variations of pull-ups exist for different skill levels?
12,Is it okay to use an assisted pull-up machine to improve my strength before attempting regular pull-ups?
12,Should my grip be wider or narrower for optimal lat engagement during pull-ups?
12,"What are some common mistakes to avoid during pull-ups, and how can I correct them?"
13,How many repetitions and sets of mountain climbers are recommended for optimal results?
13,What is the proper form to avoid straining my lower back while performing mountain climbers?
13,Can I modify the mountain climber exercise if I have limited mobility in my shoulders or hips?
13,Are there alternative exercises that target the same muscle groups as mountain climbers if I find it too challenging?
13,How can I increase the intensity of mountain climbers to further challenge my core and cardiovascular system?
14,How many leg raises should I aim for in a set to effectively work my rectus abdominis?
14,Should I keep my legs straight or slightly bent during the leg raise?
14,Is it okay if my lower back arches slightly during the exercise?
14,What modifications can I make to the leg raise if I find it too difficult?
14,How can I ensure I'm engaging my hip flexors properly during the leg raise?
15,How many repetitions and sets of tricep dips should I do for optimal triceps growth?
15,What variations of tricep dips can I do to target different areas of my triceps?
15,"Is it necessary to keep my back completely straight while performing tricep dips, or is a slight bend acceptable?"
15,"If I lack the strength to perform a full tricep dip, what modifications can I do to make the exercise easier?"
15,"Besides triceps and deltoids, what other muscles are secondarily engaged when doing tricep dips?"
16,How many repetitions and sets of Russian Twists are recommended for building core strength?
16,"Should my back be completely flat against the floor during the exercise, or is a slight lean acceptable?"
16,What modifications can I make to the Russian Twist if I find the full movement too difficult?
16,"Is it necessary to touch the floor with my hands during each twist, or can I simply twist my torso without touching?"
16,What are some common mistakes to avoid when performing Russian Twists to prevent injury?
17,How many reps and sets of burpees are recommended for building strength?
17,"Should I modify the burpee if I'm a beginner, and how?"
17,What is the proper form for the plank portion of the burpee to avoid injury?
17,Does the explosive jump at the end of the burpee add significantly to the cardio benefit?
17,Can I substitute any part of the burpee with a simpler movement if my fitness level is low?
18,How many sets and reps of dumbbell rows should I do for optimal muscle growth?
18,"Should I use a heavier weight and perform fewer reps, or a lighter weight and perform more reps for dumbbell rows?"
18,What is the proper form for dumbbell rows to avoid lower back injury?
18,Is it okay if my back arches slightly during the dumbbell row exercise?
18,Can I substitute another exercise for dumbbell rows if I don't have access to dumbbells?
19,How do I ensure my knees track over my toes during goblet squats to avoid injury?
19,"What is the ideal kettlebell weight to start with for goblet squats, and how do I progressively overload?"
19,Should my back remain straight or slightly arched during the goblet squat movement?
19,How many repetitions and sets of goblet squats are recommended for building strength and muscle mass?
19,"Is it necessary to pause at the bottom of the goblet squat, or should the movement be continuous?"
20,How many repetitions should I aim for in a Glute Bridge set?
20,Should my heels be directly beneath my knees during a Glute Bridge?
20,Is it okay if my lower back arches during the Glute Bridge exercise?
20,What modifications can I make to the Glute Bridge if I find it too easy or too difficult?
20,What are some common mistakes to avoid when performing Glute Bridges to ensure proper form and maximize results?
21,How many sets and reps of Overhead Tricep Extensions should I do for optimal triceps growth?
21,What is the proper form to avoid injuring my elbows during Overhead Tricep Extensions with dumbbells?
21,Can I modify the Overhead Tricep Extension exercise if I don't have access to dumbbells?
21,Should I use a lighter weight for Overhead Tricep Extensions if I'm new to strength training?
21,What are some alternative exercises that target the triceps similarly to Overhead Tricep Extensions?
22,How long should I hold the side plank position for optimal results?
22,Is it okay to modify the side plank by bending my bottom knee for support?
22,"What are some common mistakes to avoid when performing a side plank, and how can I correct them?"
22,"Can I incorporate side planks into a full-body workout routine, and if so, where should I place them?"
22,"Besides the obliques and shoulders, what other muscles are engaged during a side plank?"
23,How far apart should I position the cable machine handles for optimal pectoral activation during cable flyes?
23,"Should my elbows be slightly bent throughout the entire range of motion while performing cable flyes, or should they be adjusted during the movement?"
23,"What is the recommended weight to start with for cable flyes, and how can I determine the appropriate weight for my fitness level?"
23,"Is it essential to maintain a slight bend in my knees during cable flyes, or can I perform the exercise with my legs straight?"
23,To what extent should I focus on controlled movements during the concentric (bringing hands together) and eccentric (returning to starting position) phases of cable flyes?
24,How high should the bench be for optimal Step-Up results?
24,What is the ideal number of repetitions and sets for building lower body strength with Step-Ups?
24,Should I keep my core engaged throughout the entire Step-Up movement?
24,Is it okay to use a slightly unstable surface like a plyometric box for added challenge?
24,"Besides Quadriceps and Glutes, which other supporting muscles are significantly involved in performing Step-Ups?"
25,How many sets and reps of barbell rows should I do for optimal muscle growth?
25,What is the proper grip width to use when performing barbell rows to target my lats effectively?
25,Should my back be completely straight or slightly arched during the barbell row exercise?
25,"Is it important to pause at the bottom of the barbell row movement, or should I keep the movement fluid?"
25,What are some common mistakes to avoid when doing barbell rows to prevent injuries?
26,How many sets and reps of dumbbell chest press should I do for optimal muscle growth?
26,What is the proper form to avoid shoulder injuries during dumbbell chest presses?
26,Can I substitute the dumbbells with a barbell for the chest press exercise?
26,"Should I use a flat, incline, or decline bench for the best chest activation during dumbbell chest presses?"
26,What are some variations of the dumbbell chest press to target different parts of my chest?
27,"How high should the box be for optimal results, considering my current fitness level?"
27,What is the ideal number of repetitions and sets for beginners?
27,Should I focus on explosive jumps or controlled movements to maximize muscle activation?
27,Are there variations of box jumps that I can incorporate to target different muscle groups?
27,What are some common mistakes to avoid when performing box jumps to prevent injuries?
28,How many repetitions should I aim for in a set of hanging leg raises to effectively work my core?
28,What variations of hanging leg raises can I incorporate to target different areas of my core and hip flexors?
28,"Is it necessary to keep my legs completely straight throughout the hanging leg raise exercise, or can I slightly bend my knees?"
28,"If I find hanging leg raises too challenging, are there any modifications or easier alternatives I can do to build strength?"
28,What is the optimal number of sets and rest time between sets for hanging leg raises for optimal muscle growth and recovery?
29,How heavy should the dumbbells be for a beginner Farmer's Walk?
29,What is the optimal walking distance or duration for a Farmer's Walk set?
29,Should my feet be shoulder-width apart during a Farmer's Walk?
29,Can I use kettlebells instead of dumbbells for this exercise?
29,Is it okay to slightly bend my knees during a Farmer's Walk to maintain balance?
30,How many repetitions and sets of calf raises should I perform for optimal calf growth?
30,What is the ideal height of the step I should use for calf raises to maximize muscle activation?
30,Should I keep my knees slightly bent or locked during the exercise?
30,"Is it okay to use a weight while doing bodyweight calf raises, and if so how much should I add?"
30,"Can I perform calf raises on a flat surface instead of a step, and will it still be effective?"
31,How many repetitions or sets of Battle Ropes are recommended for optimal results?
31,What is the proper hand position and grip to use when performing Battle Ropes?
31,"Are there variations of Battle Ropes, and if so, could you describe some?"
31,What is the best way to control the speed and intensity of my arm movements during Battle Ropes?
31,How can I modify Battle Ropes to make it easier or harder depending on my fitness level?
32,How many reps and sets of medicine ball slams should I do for optimal results?
32,What weight medicine ball is recommended for a beginner?
32,Is there a specific technique to follow when catching the medicine ball to prevent injuries?
32,What modifications can I make if I don't have access to a medicine ball?
32,Should I focus on speed or power when slamming the medicine ball to the ground?
33,How many sets and reps of dumbbell deadlifts should I do for optimal glute activation?
33,"Should my back remain straight throughout the dumbbell deadlift movement, or is a slight curve acceptable?"
33,"What's the ideal weight to start with for dumbbell deadlifts, considering I'm a beginner?"
33,Where exactly should I focus my attention while performing dumbbell deadlifts to maintain proper form?
33,"Is it necessary to use a weightlifting belt during dumbbell deadlifts, especially if I'm lifting lighter weights?"
34,How many sets and reps of push presses should I do for optimal muscle growth?
34,What is the proper grip width for the barbell during a push press?
34,Should I use a spotter when performing heavy push presses?
34,What are some common mistakes to avoid when doing push presses to prevent injury?
34,How can I modify the push press if I don't have access to a barbell?
35,"How long should my treadmill run be to effectively target my quadriceps, hamstrings, and calves?"
35,What speed and incline on the treadmill would you recommend for a beginner aiming for improved endurance?
35,"Can I modify the Treadmill Run to focus more on one muscle group, such as my hamstrings?"
35,Are there any specific warm-up exercises I should do before starting a Treadmill Run to prevent injuries?
35,"What are some common mistakes people make during a Treadmill Run, and how can I avoid them?"
36,What incline degree is best for targeting upper chest with the Incline Dumbbell Press?
36,How can I modify the Incline Dumbbell Press to reduce strain on my shoulders?
36,Is it okay to use a slightly different weight in each hand during the Incline Dumbbell Press if I have a strength imbalance?
36,What are some common mistakes to avoid while performing the Incline Dumbbell Press to prevent injury?
36,"Besides pectorals, triceps, and deltoids, what other muscles are secondarily activated during the Incline Dumbbell Press?"
37,How many reps and sets of Renegade Rows should I do for optimal muscle growth?
37,What modifications can I make to Renegade Rows if I lack the core strength for a full plank?
37,"Is it necessary to keep my body completely straight throughout the Renegade Row exercise, or is a slight bend allowed?"
37,"Can I use kettlebells instead of dumbbells for Renegade Rows, and will the technique differ?"
37,"If I feel pain in my lower back during Renegade Rows, what adjustments can I make to correct my form?"
38,How far should I extend my legs during the leg press to maximize quadriceps activation?
38,What's the proper foot placement on the platform to best target my glutes during the leg press?
38,Should I keep my back flat against the backrest throughout the entire leg press movement?
38,Is it okay to use a slightly wider or narrower foot stance depending on which muscle group I want to emphasize?
38,"For beginners, what's a safe and effective weight to start with on the leg press machine?"
39,How many sets and reps of Cable Tricep Pushdowns should I do for optimal triceps growth?
39,What different grips can I use with the Cable Tricep Pushdown to target different triceps heads?
39,"Should I use a rope attachment or a straight bar for the Cable Tricep Pushdown, and why?"
39,"Is it okay to slightly bend my elbows at the bottom of the Cable Tricep Pushdown movement, or should they be fully extended?"
39,What are some common mistakes to avoid during the Cable Tricep Pushdown to prevent injury?
40,How far should my free leg extend behind me during the Single-Leg Deadlift?
40,What is the ideal tempo for lowering and raising the dumbbell in a Single-Leg Deadlift?
40,"Should my back remain straight throughout the Single-Leg Deadlift, or is a slight curve acceptable?"
40,Is it okay to use a lighter dumbbell if I find the Single-Leg Deadlift too difficult to perform on one leg?
40,What are some modifications to the Single-Leg Deadlift to reduce stress on my lower back?
41,How many repetitions and sets of inverted rows should I do for optimal muscle growth?
41,Can I modify the inverted row exercise if I'm a beginner and lack the strength for a full range of motion?
41,What are some common mistakes to avoid when performing inverted rows to prevent injury and maximize effectiveness?
41,Is it possible to increase the difficulty of inverted rows without changing the equipment?
41,"Besides the Latissimus Dorsi and Biceps, what other muscles are secondarily activated during the inverted row exercise?"
42,How far should I stand from the cable machine during the Pallof Press?
42,"What is the recommended resistance level for the Pallof Press, and how can I adjust it?"
42,Should I keep my core braced throughout the entire Pallof Press exercise?
42,Is it okay to slightly bend my knees while performing the Pallof Press for stability?
42,What are some common mistakes to avoid while doing the Pallof Press to prevent injury?
43,How do I maintain a straight back during the Kettlebell Deadlift to avoid lower back injury?
43,What is the ideal hip hinge movement to properly engage my glutes and hamstrings in a Kettlebell Deadlift?
43,"Should my knees track over my toes during the Kettlebell Deadlift, and how far should they bend?"
43,How can I avoid rounding my back when lifting a heavier kettlebell during the Kettlebell Deadlift?
43,What is the correct grip width and hand position for optimal form and stability in a Kettlebell Deadlift?
44,How many reps and sets of Hanging Knee Tucks should I do for optimal core strength?
44,What is the proper form to avoid straining my lower back during Hanging Knee Tucks?
44,Can I modify the Hanging Knee Tucks if I cannot do a full hang from the pull-up bar?
44,Are there alternative exercises to Hanging Knee Tucks that target similar muscle groups?
44,How long should I hold the tucked position during Hanging Knee Tucks for maximum effectiveness?
45,How many sets and repetitions of resistance band pull aparts should I perform for optimal rear delt development?
45,"What is the ideal resistance band tension level to use for resistance band pull aparts, considering my current strength level?"
45,Should I focus on slow controlled movements or faster reps during resistance band pull aparts for muscle hypertrophy?
45,"Besides rear deltoids, trapezius, and rhomboids, what other muscles are secondarily activated during resistance band pull aparts?"
45,Are there any common mistakes to avoid while performing resistance band pull aparts to prevent injury and maximize effectiveness?
46,How far should my back knee be from the bench during Bulgarian Split Squats?
46,Should my front knee track over my ankle during the lowering phase of a Bulgarian Split Squat?
46,What is the ideal range of motion for the Bulgarian Split Squat to maximize muscle activation?
46,Can I modify the Bulgarian Split Squat if I lack the necessary balance or stability?
46,"Besides quadriceps, glutes, and hamstrings, what other muscles are supporting during this exercise?"
47,How many sets and repetitions of seated shoulder presses are recommended for building muscle mass?
47,Should my elbows be slightly bent or fully locked out at the top of the seated shoulder press?
47,What is the proper breathing technique to use during the concentric and eccentric phases of the seated shoulder press?
47,Can I substitute the dumbbells with a barbell for the seated shoulder press exercise?
47,"What are some common mistakes to avoid while performing seated shoulder presses with dumbbells, and how can I correct them?"
48,"How high should the elevated surface be for incline push-ups, and does the height significantly change the difficulty?"
48,What modifications can I make to incline push-ups if I find the standard version too challenging?
48,"Besides pectorals, triceps, and deltoids, which other muscles are secondarily engaged during incline push-ups?"
48,"Are there variations of incline push-ups that target specific muscle groups more intensely, for instance, focusing on the upper or lower chest?"
48,What is the recommended number of sets and repetitions for incline push-ups to see optimal results for muscle growth and strength building?
49,How many sets and reps of hip thrusts should I do for optimal glute growth?
49,What is the proper bar placement on my hips during hip thrusts to avoid injury?
49,Should my knees be pointing straight ahead or slightly outwards during the hip thrust movement?
49,Is it okay to use a weight that challenges me even if my form is not perfect on every repetition?
49,What are some modifications I can make to the hip thrust exercise if I don't have access to a barbell?
50,How much weight should I use for barbell curls if I'm a beginner?
50,What is the correct underhand grip width for barbell curls to maximize bicep activation?
50,"Should my elbows be tucked in close to my sides during the barbell curl movement, or can they flare out slightly?"
50,"To avoid injury, what specific points should I pay attention to regarding my form during the lowering (negative) phase of the barbell curl?"
50,"Is it better to do barbell curls with a straight bar or an EZ bar, considering my wrists are prone to pain?"
51,How do I adjust the cable weight on the machine for the Cable Row exercise?
51,What is the proper grip width I should use when performing Cable Rows to maximize Latissimus Dorsi activation?
51,Should my back be straight or slightly arched during the Cable Row movement?
51,How can I ensure that I'm using my back muscles and not just my arms during the Cable Row exercise?
51,"Is it acceptable to slightly lean back during the pull phase of a Cable Row, or should I remain upright?"
52,How many repetitions of shoulder taps should I perform on each side during one set of Plank Shoulder Taps?
52,Is it acceptable to slightly bend my knees while performing Plank Shoulder Taps if I find it difficult to maintain a full plank?
52,Should I prioritize speed or controlled movements when tapping my shoulders during Plank Shoulder Taps?
52,What modifications can I make to Plank Shoulder Taps to reduce the intensity if I'm a beginner?
52,"If I feel my lower back arching during Plank Shoulder Taps, what adjustments to my form should I make?"
53,How many sets and reps of Dumbbell Lateral Raises should I do for optimal deltoid growth?
53,Should I use a slow controlled movement or a faster tempo during the Dumbbell Lateral Raise exercise?
53,What is the correct hand position for Dumbbell Lateral Raises to avoid injury and maximize muscle activation?
53,"Is it okay to slightly bend my elbows during the Dumbbell Lateral Raise, or should they remain straight?"
53,"Besides the deltoids, what other muscles are secondarily engaged in Dumbbell Lateral Raises?"
