id,question
157,How low should my hips go during the single-leg squat to ensure proper form?
157,Should my extended leg be kept straight or slightly bent during the single-leg squat?
157,"What can I do to improve balance during the single-leg squat, as I find myself wobbling?"
157,"If I can't lower my hips parallel to the floor, should I still attempt the exercise or modify it?"
157,Are there any variations of the single-leg squat that could be more suitable for beginners or to target specific muscle groups?
158,How many repetitions should I aim for in a set of Push-Up to Rows?
158,What is the ideal dumbbell weight for a beginner performing this exercise?
158,Should my elbows be close to my body or flared out during the push-up and row phases?
158,Is it acceptable to modify the exercise by using my knees instead of my toes for the push-up?
158,Does this exercise require any specific breathing techniques for optimal performance?
159,How many sets and reps of Smith Machine Rows are recommended for building back thickness?
159,Should my back be straight or slightly arched during the Smith Machine Row?
159,What grip width is optimal for maximizing Latissimus Dorsi activation during Smith Machine Rows?
159,"Is it better to use a pronated or supinated grip for Smith Machine Rows, and why?"
159,How can I modify the Smith Machine Row exercise to reduce strain on my lower back?
160,How many sets and reps of lat pullovers should I do for optimal muscle growth?
160,What is the proper grip to use when performing the lat pullovers with a dumbbell?
160,Should my elbows be straight or slightly bent during the lowering phase of the lat pullovers?
160,Is it okay to use a lighter weight and focus on controlled movements instead of heavier weight and faster reps?
160,What modifications can I make to this exercise if I don't have access to a bench?
161,How many sets and reps of Smith Machine Shoulder Press should I do for optimal muscle growth?
161,What is the proper grip width for the Smith Machine Shoulder Press to maximize deltoid activation?
161,"Should I use a spotter when performing Smith Machine Shoulder Press, considering the fixed bar path?"
161,Can I modify the Smith Machine Shoulder Press to reduce strain on my shoulders if I have pre-existing injuries?
161,How can I progress the weight used in Smith Machine Shoulder Press while maintaining proper form to avoid injury?
162,How many repetitions and sets of Cable Woodchoppers should I perform for optimal core engagement?
162,What is the proper hand grip and stance to maximize the effectiveness of the Cable Woodchopper exercise?
162,Should I use a slow and controlled motion or a more explosive movement for the Cable Woodchopper?
162,Can I modify the Cable Woodchopper exercise if I lack access to a cable machine?
162,"What are some common mistakes to avoid when performing Cable Woodchoppers, to prevent injury and maximize results?"
163,How many repetitions and sets should I do for the Machine Back Extension to build lower back strength?
163,"What is the proper form for the Machine Back Extension, and how can I avoid lower back injury?"
163,Can I modify the Machine Back Extension exercise if I have limited lower back mobility?
163,Is the Machine Back Extension an effective exercise for improving hamstring flexibility and strength?
163,What are some alternative exercises if I don't have access to a back extension machine?
164,How many sets and reps of prone leg curls should I do for optimal hamstring growth?
164,What is the correct starting position for the prone leg curl machine to avoid injury?
164,Should I use a full range of motion or a partial range of motion during the prone leg curl exercise?
164,Is it okay to slightly arch my back during the prone leg curl to stabilize my body?
164,Can I substitute the prone leg curl machine with bodyweight exercises if I don't have access to a gym?
165,How many sets and reps of seated dumbbell press should I do for optimal muscle growth?
165,What is the proper hand grip and posture to maintain during the seated dumbbell press to prevent injury?
165,"Should I use a spotter when performing the seated dumbbell press, especially with heavier weights?"
165,Can I substitute the seated dumbbell press with another exercise if I don't have access to dumbbells?
165,"How can I modify the seated dumbbell press to make it easier or more challenging, depending on my fitness level?"
166,How long should I hold the weighted plank to see optimal results for core strengthening?
166,What is the recommended weight plate size for beginners to start with a weighted plank?
166,Can I modify the weighted plank if I don't have access to weight plates?
166,"Is it essential to keep my back completely straight during the weighted plank, or is a slight arch acceptable?"
166,"Besides the rectus abdominis and obliques, what other muscles are significantly engaged during the weighted plank?"
167,How many calories can I expect to burn in a 30-minute Step Mill session at a moderate intensity?
167,What is the recommended cadence (steps per minute) for beginners on the Step Mill?
167,"Besides quads, glutes, hamstrings, and calves, does the Step Mill also work other muscle groups?"
167,Are there any modifications I can make to the Step Mill exercise to reduce the impact on my knees?
167,"Can I incorporate interval training into my Step Mill workout, and if so, what would be a good interval structure for a beginner?"
168,How many sets and reps of Standing Resistance Band Rows should I do for optimal muscle growth?
168,Should I keep my back straight and core engaged throughout the Standing Resistance Band Row exercise?
168,What type of resistance band tension is recommended for beginners performing Standing Resistance Band Rows?
168,"If I don't have access to a sturdy anchor point, are there alternative ways to perform this exercise?"
168,Is it necessary to use a specific type of resistance band for Standing Resistance Band Rows or can I use any kind?
169,How many sets and reps of Dumbbell Lunges should I do for optimal muscle growth?
169,"Should my front knee go beyond my toes during the Dumbbell Lunge exercise, and why or why not?"
169,What is the proper dumbbell weight to use for Dumbbell Lunges based on my current fitness level?
169,Can I modify the Dumbbell Lunge if I have limited space to prevent myself from stepping too far forward and losing balance?
169,"Besides quadriceps, glutes and hamstrings, what other muscles are minimally activated while performing Dumbbell Lunges?"
170,How many sets and reps of reverse curls should I do for optimal bicep growth?
170,Should I use a heavier weight for reverse curls than I use for regular bicep curls?
170,"What is the proper form to avoid injury during reverse curls, particularly in regards to my wrists?"
170,Can I substitute another exercise if I don't have dumbbells available for reverse curls?
170,Does the overhand grip significantly impact the muscle activation compared to an underhand grip during reverse curls?
171,How many repetitions should I aim for in a set of banded pull-ups to effectively build upper body strength?
171,Should my knees be positioned at the top or bottom of the resistance band for optimal support during the banded pull-up?
171,What specific variations of the banded pull-up can I use to target different aspects of my lats and biceps?
171,"Can I modify the banded pull-up to make it easier if I am a beginner, and how would I do that?"
171,"If I don't have access to a pull-up bar, are there any alternative exercises that use resistance bands and work similar muscle groups?"
172,How many sets and repetitions of Cable Face Pulls are recommended for building rear deltoid strength?
172,Should I use a wide or narrow grip on the rope handle for optimal activation of the rhomboids during Cable Face Pulls?
172,"What is the proper elbow height and trajectory to maintain for effective Cable Face Pulls, and how can I avoid injury?"
172,Can I substitute any other exercise if I don't have access to a cable machine for Cable Face Pulls?
172,Is it advisable to incorporate Cable Face Pulls into a workout routine focused on improving posture and upper back strength?
173,How do I maintain a stable core throughout the entire Turkish Get-Up?
173,What modifications can I make if I lack the strength to perform a full Turkish Get-Up with the kettlebell overhead?
173,Is it okay to use a lighter kettlebell to practice the movement until I build strength?
173,Should my back remain in contact with the floor during the lying-down phase?
173,What is the proper breathing technique to use during the Turkish Get-Up?
174,How many repetitions should I do for each side to see optimal results for strengthening my obliques?
174,What is the ideal weight of the medicine ball for a beginner to ensure proper form and avoid injury?
174,"Should my back remain straight during the entire movement, or is a slight rounding acceptable?"
174,"If I don't have a medicine ball, can I substitute it with another piece of equipment for this exercise?"
174,Does the speed of the twist impact the effectiveness of the exercise in targeting my rectus abdominis?
175,How many sets and reps of Cable Front Raises should I do for optimal deltoid growth?
175,What is the ideal weight to use for Cable Front Raises to ensure proper form and avoid injury?
175,Should I pause at the top or bottom of the Cable Front Raise movement?
175,Should my elbows be slightly bent or straight during the Cable Front Raise exercise?
175,Is it okay to use a rope attachment instead of the standard handle for Cable Front Raises?
176,How many repetitions and sets of reverse crunches should I aim for as a beginner?
176,Should my lower back be pressed to the ground throughout the entire reverse crunch movement?
176,What modifications can I make to the reverse crunch if I find the standard version too challenging?
176,Is it okay to use momentum to bring my knees closer to my chest during the reverse crunch?
176,"Besides rectus abdominis and hip flexors, what other muscles are secondarily engaged during reverse crunches?"
177,How many sets and reps of Cable Tricep Kickbacks are recommended for optimal triceps growth?
177,"Should I use a straight bar or a rope attachment for the Cable Tricep Kickback, and why?"
177,"What is the proper form to avoid injury during Cable Tricep Kickbacks, focusing on my elbow position and back posture?"
177,Can I modify the Cable Tricep Kickback exercise if I lack access to a cable machine?
177,"Besides triceps, which other muscles are significantly engaged during the Cable Tricep Kickback, and how can I emphasize triceps activation?"
178,How high should my hips be off the ground during a Copenhagen Plank for optimal engagement?
178,What modifications can I make to the Copenhagen Plank if I lack the strength to hold the full position?
178,Is it okay to slightly bend my supporting leg during the Copenhagen Plank to reduce strain?
178,"Besides obliques and adductors, what other muscles are indirectly activated in the Copenhagen Plank?"
178,"How long should I hold the Copenhagen Plank position to see effective results, and how many repetitions should I aim for?"
179,How many sets and reps of Smith Machine Incline Press are recommended for building muscle mass?
179,"What incline degree is optimal for targeting the upper, middle, and lower chest during Smith Machine Incline Press?"
179,Should I use a narrow or wide grip for Smith Machine Incline Press to emphasize different muscle groups?
179,What are some common mistakes to avoid during Smith Machine Incline Press to prevent injury?
179,"Is it possible to substitute the Smith Machine Incline Press with another exercise using free weights, and if so, which one?"
180,How wide should my grip be on the bar for optimal Latissimus Dorsi activation during the Cable Lat Pulldown?
180,What is the correct posture I should maintain throughout the Cable Lat Pulldown exercise to prevent injury?
180,"Should I use a slow and controlled movement throughout the entire range of motion for the Cable Lat Pulldown, or is a faster movement acceptable?"
180,"If I don't have access to a lat pulldown machine, what alternative exercises can I do to target the same muscle groups?"
180,"To increase the intensity of my Cable Lat Pulldown workout, should I focus on increasing weight, reps, or sets, and in what order?"
181,How many reps and sets should I do for the Cable Side Lunge to effectively build lower body strength?
181,"What is the ideal weight or resistance level to use when performing Cable Side Lunges, considering my current fitness level?"
181,Should I keep my torso upright or lean slightly forward during the Cable Side Lunge exercise?
181,Is it necessary to use a pulley positioned at lower height for this exercise or can I adjust the cable height?
181,"To maximize glute activation during Cable Side Lunges, should I focus on a slow controlled movement and pause at the bottom of the lunge?"
182,How many sets and reps of Dumbbell Bent-Over Rows should I perform for optimal muscle growth?
182,"What is the proper form to avoid injury while performing Dumbbell Bent-Over Rows, focusing on back posture?"
182,Should my back be completely flat or slightly arched during the Dumbbell Bent-Over Row exercise?
182,"Can I substitute Dumbbell Bent-Over Rows with a similar exercise using barbells, and if so, what is the equivalent exercise?"
182,"If I feel the exercise strain my lower back more than my upper back, what modifications should I make to my form or weight?"
183,How far should I step out to the side during a lateral lunge to ensure proper form and maximize muscle activation?
183,Should my front knee stay aligned with my ankle throughout the lateral lunge movement to prevent injury?
183,"What is the ideal range of motion for a lateral lunge, and how can I adjust the depth to suit my fitness level?"
183,"Is it necessary to maintain a straight posture while performing a lateral lunge, and what muscle groups can help support proper form?"
183,"Besides the quadriceps, glutes, and adductors, what other muscles might be engaged during a lateral lunge, even passively?"
184,How do I adjust the seat height for optimal rowing posture on the seated machine row?
184,What is the correct handle grip to maximize Latissimus Dorsi activation during the seated machine row?
184,"Should my back remain straight throughout the entire seated machine row movement, or is a slight rounding acceptable?"
184,"At what point in the seated machine row should I exhale, and at what point should I inhale?"
184,"Besides the Latissimus Dorsi and Biceps, what other muscles are secondarily engaged during the seated machine row?"
185,How many repetitions of the ab wheel rollout should I aim for in each set to effectively target my rectus abdominis?
185,What modifications can I make to the ab wheel rollout if I find the standard version too challenging for my current fitness level?
185,"Is it necessary to keep my back perfectly straight throughout the entire ab wheel rollout exercise, or is a slight arch acceptable?"
185,What are some common mistakes to avoid during the ab wheel rollout exercise to prevent injury and ensure proper form?
185,"Can I substitute the ab wheel with another piece of equipment if I don't have access to one, while maintaining the same core engagement?"
186,How many reps and sets of Decline Russian Twists should I do for optimal core engagement?
186,What is the proper form to avoid strain on my lower back while performing Decline Russian Twists?
186,Can I modify the Decline Russian Twist if I don't have access to a decline bench?
186,"Should I hold my breath while twisting my torso during Decline Russian Twists, or should I breathe normally?"
186,"Besides obliques and rectus abdominis, which other muscles are indirectly involved in performing this exercise?"
187,How many sets and reps of Deadlift High Pulls are recommended for building strength?
187,Should I use a narrower or wider grip during the Deadlift High Pull for optimal form?
187,What is the proper breathing technique throughout the entire Deadlift High Pull movement?
187,"Is it necessary to pause at the bottom of the deadlift portion of the Deadlift High Pull, or should I move explosively?"
187,"What are some common mistakes to avoid when performing Deadlift High Pulls, and how can I correct them?"
188,How many sets and reps should I do for Smith Machine Incline Press to build muscle?
188,What incline angle is best for maximizing pectoral activation during the Smith Machine Incline Press?
188,"Should I use a narrow or wide grip when performing the Smith Machine Incline Press, and why?"
188,What are some common mistakes to avoid when performing the Smith Machine Incline Press to prevent injury?
188,How can I modify the Smith Machine Incline Press to accommodate my current strength level if I'm a beginner?
189,How wide should my grip be on the lat pulldown bar for optimal Lat engagement?
189,Should my elbows be tucked in close to my body during the entire movement or can they flare out slightly?
189,What is the ideal tempo for the concentric and eccentric phases of the Reverse Grip Lat Pulldown to maximize muscle growth and minimize injury risk?
189,"Is it acceptable to use a spotter for assistance on this exercise, and if so, what should the spotter do?"
189,Should I focus on controlled movements or explosive power during each repetition of the Reverse Grip Lat Pulldown?
190,How many reps and sets should I do for the Cable Lateral Lunge to effectively target my glutes and quads?
190,What is the optimal weight or resistance to use for this exercise to ensure proper form and avoid injury?
190,"Should I focus on a slow, controlled movement during the Cable Lateral Lunge, or should I use more explosive power?"
190,"Is it acceptable to slightly bend my supporting leg during the Cable Lateral Lunge, or should it be kept straight?"
190,"How can I modify the Cable Lateral Lunge exercise to make it easier or more challenging, depending on my fitness level?"
191,How many repetitions should I aim for in a Pike Push-Up set?
191,What are some modifications for Pike Push-Ups if I'm a beginner?
191,Should my hips be completely straight or slightly bent during a Pike Push-Up?
191,Does the Pike Push-Up work any other muscles besides the deltoids and triceps?
191,What is the correct breathing technique for performing a Pike Push-Up effectively?
192,How do I maintain proper form throughout the One-Arm Dumbbell Snatch to avoid injury?
192,"What is the ideal weight dumbbell to start with for One-Arm Dumbbell Snatch, considering I'm a beginner?"
192,Should I prioritize speed or controlled movement during the explosive pulling phase of the One-Arm Dumbbell Snatch?
192,Can I modify the One-Arm Dumbbell Snatch exercise to accommodate limited overhead mobility?
192,"What are some common mistakes to watch out for while performing One-Arm Dumbbell Snatch, and how can I correct them?"
193,How far should my knees go during the cable front squat to maximize quadriceps activation?
193,What is the ideal weight or resistance to start with for cable front squats if I'm a beginner?
193,Should I keep my back straight or slightly arched during the cable front squat?
193,Is it okay to use a different attachment besides the rope handle on the cable machine for this exercise?
193,How many sets and reps of cable front squats are recommended for building lower body strength and hypertrophy?
194,How far should I stand from the tire before initiating the flip?
194,What is the ideal tire size and weight for a beginner?
194,"Should my grip be overhand, underhand, or mixed for optimal leverage during the lift?"
194,Is it crucial to keep my back straight during the entire movement to avoid injury?
194,What alternative exercises can I do if I don't have access to a tire?
195,How many sets and reps of Smith Machine Calf Raises should I do for optimal calf growth?
195,"Should I use a weight that allows me to complete all reps with good form, or should I push myself to failure on each set?"
195,Is it okay if my knees slightly bend during the upward movement of the Smith Machine Calf Raise?
195,"What is the best foot placement (distance between feet, position on the step) for effective Smith Machine Calf Raises?"
195,"Besides a step, can I use anything else to elevate my heels in a Smith Machine Calf Raise?"
196,How many repetitions should I aim for on each leg for optimal results with Pistol Squats to Box?
196,Is it necessary to use a box of a specific height for the Pistol Squat to Box exercise?
196,What modifications can I make to the Pistol Squat to Box if I find the full range of motion too challenging?
196,What are the common mistakes to avoid when performing the Pistol Squat to Box exercise to prevent injury?
196,How can I progress the Pistol Squat to Box exercise once I master the basic movement?
197,How many sets and reps of Standing Chest Fly should I do for optimal pectoral growth?
197,What weight should I use for Standing Chest Fly to ensure proper form and challenge?
197,"Should I focus on a slow and controlled movement or a faster, more explosive movement during the Standing Chest Fly exercise?"
197,Does the angle of my body during the Standing Chest Fly affect the muscles targeted?
197,What are some common mistakes to avoid while performing Standing Chest Fly on a cable machine?
198,How many repetitions and sets of sled drags are recommended for building strength?
198,What is the ideal weight to start with for sled drags to avoid injury?
198,Should I walk or run backward while performing sled drags for optimal results?
198,Which variations of the sled drag exercise can I incorporate for a more challenging workout?
198,"Can I perform sled drags on an inclined surface, and if so, what modifications should I make?"
199,How many sets and reps of Cable Hammer Curls do you recommend for building bicep size?
199,Should I use a lighter weight and focus on controlled movements for Cable Hammer Curls or go heavier with more momentum?
199,Is it okay to slightly adjust my grip during the Cable Hammer Curl to target different parts of my biceps?
199,What are some common mistakes to avoid when performing Cable Hammer Curls with a cable machine?
199,Can I substitute the low pulley Cable Hammer Curl with another exercise if the cable machine is unavailable?
200,How many sets and reps of Cable Tricep Overhead Extensions should I do for optimal triceps growth?
200,What is the proper grip width to use for the Cable Tricep Overhead Extension to maximize activation of the triceps?
200,"Should I use a straight bar or a rope attachment for the Cable Tricep Overhead Extension, and why?"
200,"To avoid injury, what is the most important thing to focus on in maintaining good form during a Cable Tricep Overhead Extension?"
200,Can I modify the Cable Tricep Overhead Extension to accommodate for limited range of motion in my elbows?
201,How far should I pull the handle towards my torso during a Seated Cable Row?
201,What is the proper grip width to use for the Seated Cable Row exercise?
201,Should my back be straight or slightly arched when performing a Seated Cable Row?
201,"What is the recommended weight to start with for Seated Cable Rows, considering I'm a beginner?"
201,How many repetitions and sets are ideal for building strength with Seated Cable Rows?
202,How many sets and repetitions of Lying Dumbbell Tricep Extensions are recommended for building triceps mass?
202,Should I use a heavier dumbbell if I can easily perform 15 repetitions without feeling fatigued?
202,What is the proper form to avoid strain on my elbows while performing Lying Dumbbell Tricep Extensions?
202,Is it okay to slightly adjust the position of the dumbbell to accommodate my shoulder mobility during the exercise?
202,Can I substitute this exercise with another triceps exercise if I don't have access to dumbbells?
203,How much weight should I add to my Weighted Pull-Ups to effectively challenge my muscles without compromising form?
203,What is the proper grip width for Weighted Pull-Ups to maximize Latissimus Dorsi activation?
203,"Should I use a dumbbell or weight plate for the added weight in Weighted Pull-Ups, and why?"
203,"If I can't perform a single Weighted Pull-Up, what are some suitable regressions to build strength and work towards the full exercise?"
203,"Besides Latissimus Dorsi and Biceps, which other supporting muscles are significantly engaged during Weighted Pull-Ups?"
204,How many sets and reps of Incline Dumbbell Rows should I do for optimal muscle growth?
204,"What incline degree on the bench is recommended for Incline Dumbbell Rows, and how does it affect the exercise?"
204,"Is it crucial to keep my back straight throughout the Incline Dumbbell Row movement, and how can I improve my posture?"
204,"Should I use a lighter weight and focus on controlled form during Incline Dumbbell Rows, or push myself to lift heavier?"
204,What are some common mistakes to avoid during Incline Dumbbell Rows to prevent injuries?
205,How many sets and reps of machine lat pulldowns should I perform for optimal muscle growth?
205,What grip width is recommended for maximizing latissimus dorsi activation during the lat pulldown?
205,"Should I focus on a controlled, slow movement throughout the entire range of motion for lat pulldowns, or should I incorporate explosiveness?"
205,Is it important to keep my back straight throughout the exercise to prevent injury when doing lat pulldowns?
205,"If I don't have access to a lat pulldown machine, what alternative exercises can I do to target the same muscle groups?"
206,How many sets and reps should I do for optimal Latissimus Dorsi growth using the One-Arm Cable Row?
206,What is the ideal weight to use to ensure proper form and avoid injury during the One-Arm Cable Row?
