id,question
54,How long should I hold the 90-degree angle in a wall sit to effectively work my quadriceps and glutes?
54,What modifications can I make to the wall sit if I have knee pain?
54,Is it necessary to keep my back completely flat against the wall during the entire wall sit?
54,"Besides quadriceps and glutes, which other muscles are engaged, even if secondarily, during a wall sit?"
54,"If I can't hold a 90-degree angle, can I still benefit from a wall sit by adjusting the angle of my knees?"
55,How many repetitions should I aim for on each side during a Spider Plank set?
55,Should my knees be touching my elbows when performing a Spider Plank?
55,What modifications can I make to the Spider Plank if I find the standard version too challenging?
55,Is it okay to slightly rest between bringing my knees to my elbows during the Spider Plank exercise?
55,Does the Spider Plank primarily work the upper or lower abs more?
56,How wide should my stance be for a proper Sumo Deadlift?
56,Should my knees track over my toes during the Sumo Deadlift lift?
56,What is the optimal grip width for the barbell in a Sumo Deadlift?
56,How can I engage my glutes more effectively during the Sumo Deadlift?
56,Is it crucial to maintain a straight back throughout the entire Sumo Deadlift movement?
57,How many repetitions and sets should I do for optimal latissimus dorsi engagement during Single Arm Dumbbell Rows?
57,What is the ideal dumbbell weight to use for proper form and muscle activation without compromising my posture during Single Arm Dumbbell Rows?
57,Should I keep my back straight and core engaged throughout the entire movement to prevent injuries while performing Single Arm Dumbbell Rows?
57,"To maximize bicep activation during Single Arm Dumbbell Rows, should I focus on a controlled movement and a peak contraction at the top of the row?"
57,"Is it necessary to use a bench for support, or can I perform Single Arm Dumbbell Rows by maintaining balance without external support?"
58,How many repetitions and sets are recommended for building shoulder strength with Kettlebell Clean and Presses?
58,What is the proper grip and swing technique to avoid injury during the kettlebell clean portion of the exercise?
58,Should I focus on explosive power or controlled movements during the press phase of the Kettlebell Clean and Press?
58,Can I modify the Kettlebell Clean and Press to accommodate limited shoulder mobility?
58,What are the common mistakes to avoid when performing the Kettlebell Clean and Press to maximize its effectiveness and reduce injury risk?
59,How many calories can I expect to burn jumping rope for 30 minutes at a moderate pace?
59,Should I use a weighted jump rope to increase the intensity and calorie burn?
59,What is the recommended number of repetitions or sets for a beginner jump rope workout?
59,Are there variations of jump rope exercises to target specific muscle groups more effectively?
59,What is the correct posture and foot placement for optimal jump rope technique to prevent injuries?
60,How far should I step out to the side during a side lunge to ensure proper form and maximize muscle activation?
60,"Should my front knee track over my ankle during the side lunge, or is a slight deviation acceptable?"
60,What is the ideal range of motion for the knee bend in a side lunge to effectively target the glutes and quads?
60,Is it necessary to keep my back straight and core engaged throughout the entire side lunge exercise?
60,"If I experience knee pain during side lunges, what modifications can I make to reduce the stress on my knees, and should I consult a physician?"
61,How many sets and reps of Machine Chest Fly are recommended for building muscle mass?
61,What is the proper posture to maintain throughout the Machine Chest Fly exercise to prevent injury?
61,Should I fully extend my arms at the end of each repetition during the Machine Chest Fly exercise?
61,Can I adjust the weight on the Machine Chest Fly machine to fit my fitness level?
61,"If I don't have access to a machine, what is a good alternative exercise for targeting the same muscles?"
62,How many sets and reps of hack squats should I do for optimal quadriceps growth?
62,What is the proper foot placement on the hack squat platform to emphasize glute activation?
62,Should I prioritize a controlled descent or explosive ascent during the hack squat exercise?
62,What are some common mistakes to avoid when performing hack squats to prevent injury?
62,"Can I adjust the machine's weight plates during the set, or do I need to reset the weight between sets?"
63,How high should the elevated surface be for optimal Decline Push-Up form?
63,What modifications can I make to Decline Push-Ups if I'm a beginner and find them too difficult?
63,Should my elbows be tucked in close to my body or flared out during the Decline Push-Up?
63,How many repetitions and sets of Decline Push-Ups are recommended for building upper body strength?
63,"Are Decline Push-Ups more effective for targeting specific muscles compared to standard push-ups, and if so, which muscles are more emphasized?"
64,How many sets and reps of Band Face Pulls should I do for optimal results?
64,Should I use a lighter or heavier resistance band for this exercise?
64,What is the proper hand position and grip for performing Band Face Pulls correctly?
64,How can I modify the Band Face Pull exercise if I lack access to a high anchor point?
64,What are some common mistakes to avoid while doing Band Face Pulls to prevent injury?
65,How many repetitions of ab wheel rollouts should I perform for optimal core engagement?
65,What modifications can I make to the ab wheel rollout if I lack sufficient core strength?
65,Is it necessary to keep my back completely straight during the entire ab wheel rollout movement?
65,Should I exhale during the rollout or the return to the starting position?
65,What are some common mistakes to avoid when performing ab wheel rollouts to prevent injury?
66,How many repetitions should I aim for on each side for optimal glute activation during Side Leg Raises?
66,Should I keep my lower leg straight or slightly bent during the Side Leg Raise exercise?
66,"Is it necessary to hold my top leg at the peak of the movement during Side Leg Raises, or can I just briefly pause?"
66,"To avoid straining my hip flexors, should I focus on slow and controlled movements during Side Leg Raises?"
66,What modifications can I make to the Side Leg Raise exercise if I experience lower back pain?
67,How far should my hips travel backward during the Romanian Deadlift?
67,"Should my back remain straight throughout the entire movement, or is slight rounding acceptable?"
67,What is the optimal grip width for a Romanian Deadlift with a barbell?
67,"What are the key differences between a Romanian Deadlift and a conventional Deadlift, focusing on hip and back movement?"
67,How many sets and reps of Romanian Deadlifts are ideal for building hamstring strength and hypertrophy?
68,How many sets and reps of Arnold Presses should I do for optimal deltoid growth?
68,Should I use a heavier weight if I can't complete the full rotation with control?
68,What is the proper dumbbell weight to start with if I'm a beginner?
68,"Does the Arnold press work the front, middle, or all three heads of the deltoids?"
68,Can I modify the Arnold press to make it easier if I have shoulder pain?
69,How many sets and reps of Landmine Press are recommended for building upper body strength?
69,What is the proper grip width to use during the Landmine Press to maximize pectoral activation?
69,"Should I use a spotter when performing the Landmine Press, given it's a unilateral exercise?"
69,Are there any variations of the Landmine Press to target the deltoids more effectively?
69,What are some common mistakes to avoid when performing the Landmine Press to prevent injury?
70,How many tuck jumps should I aim for in a single set to effectively work my quads and glutes?
70,What is the proper landing technique to minimize impact on my knees during tuck jumps?
70,Should I keep my arms swinging during the jump for better momentum and power?
70,"Is it okay to modify the tuck jump by just jumping vertically without knee tucks, if I'm a beginner?"
70,"Can I incorporate tuck jumps into a HIIT workout routine and if so, how many repetitions and rest periods would be appropriate?"
71,How many repetitions should I aim for in a set of Windshield Wipers?
71,What is the proper form to avoid straining my lower back during Windshield Wipers?
71,Can I modify the Windshield Wipers exercise if I have limited mobility in my hips?
71,Should I breathe in or out during the leg rotation in Windshield Wipers?
71,What are some alternative exercises to target the same muscle groups as Windshield Wipers if I find it too difficult?
72,How many sets and reps of dumbbell shrugs should I do for optimal trapezius growth?
72,"What is the proper form for dumbbell shrugs to avoid injury, specifically regarding shoulder and neck positioning?"
72,Can I substitute the dumbbells with another type of weight for dumbbell shrugs?
72,Should I focus on slow controlled movements or faster reps during dumbbell shrugs for muscle growth?
72,"Besides the trapezius, which other muscles are secondarily activated during dumbbell shrugs?"
73,How far should I push the sled for optimal results?
73,What is the recommended weight to start with for a beginner?
73,"Should I focus on short, explosive pushes or longer, controlled pushes?"
73,"Is it okay to slightly bend my knees while pushing the sled, or should they be locked?"
73,What are some variations of the sled push to target different muscle groups more effectively?
74,How many sets and reps of Cable Bicep Curls should I do for optimal bicep growth?
74,What is the proper grip width to use when performing Cable Bicep Curls to maximize bicep activation?
74,"Should I use a straight bar or a rope attachment for Cable Bicep Curls, and why?"
74,Is it okay to slightly lean back during the Cable Bicep Curl movement to increase the range of motion?
74,"Besides biceps and forearms, what other muscles are secondarily engaged during Cable Bicep Curls?"
75,How many repetitions and sets of Dumbbell Kickbacks are recommended for building triceps strength?
75,Should I keep my elbows close to my body throughout the Dumbbell Kickback exercise?
75,"What is the proper form to avoid injury while performing Dumbbell Kickbacks, especially concerning my lower back?"
75,Is it okay to use lighter dumbbells if I can't perform the full range of motion with heavier ones during Dumbbell Kickbacks?
75,Can I substitute the Dumbbell Kickback with another exercise if I don't have access to dumbbells?
76,How many repetitions of flutter kicks should I aim for during one set?
76,Should I keep my lower back pressed to the ground throughout the entire exercise?
76,What modifications can I make to the flutter kicks if I find the standard version too difficult?
76,"Is it okay to pause briefly between kicking each leg, or should the movement be continuous?"
76,"Besides the rectus abdominis and hip flexors, are any other muscle groups significantly engaged during flutter kicks?"
77,How many repetitions or how long should I perform high knees for optimal results?
77,Is there a variation of high knees suitable for beginners or those with knee problems?
77,What is the ideal pace to maintain while doing high knees to maximize calorie burn?
77,Should I keep my arms still or use them to help drive my knees upward during high knees?
77,"Besides cardio, what other benefits can I expect from incorporating high knees into my workout routine?"
78,How many repetitions and sets of sledgehammer slams are recommended for optimal results?
78,What is the proper grip and stance to use when performing sledgehammer slams to avoid injuries?
78,Are there variations of sledgehammer slams that target different muscle groups more effectively?
78,"What is the ideal weight of the sledgehammer for a beginner, and how can I gradually increase the weight?"
78,What alternative exercises can I incorporate into my routine if I don't have access to a tire or a suitable soft surface for sledgehammer slams?
79,How high should the bench or box be for optimal results during Lateral Step-Ups?
79,Should I keep my chest up and core tight throughout the Lateral Step-Up movement?
79,What is the ideal number of repetitions and sets for Lateral Step-Ups to build strength and improve lower body stability?
79,"Is it important to control the descent during Lateral Step-Ups, and why?"
79,"Can I modify Lateral Step-Ups to make them easier or more challenging, and how?"
80,How many sets and reps of Cable Chest Press should I do for optimal muscle growth?
80,What's the proper hand grip width for Cable Chest Press to target different pectoral areas?
80,Should I keep my elbows slightly bent or locked during the Cable Chest Press exercise?
80,How can I modify the Cable Chest Press to reduce strain on my shoulders?
80,What are some common mistakes to avoid while performing Cable Chest Press?
81,How many sets and reps of TRX Rows should I do for optimal muscle growth?
81,What is the correct body angle to maintain during the TRX Rows exercise to avoid injury?
81,"Should my arms be fully extended at the starting position of the TRX Row, or slightly bent?"
81,"Besides the Latissimus Dorsi and Biceps, what other muscles are secondarily engaged during TRX Rows?"
81,"If I don't have access to a TRX Suspension Trainer, what alternative exercises can I substitute to target the same muscle groups?"
82,How many repetitions per side should I aim for during a Medicine Ball Russian Twist set?
82,What is the recommended weight of the medicine ball for a beginner performing Medicine Ball Russian Twists?
82,Should my back be completely straight or slightly arched while doing Medicine Ball Russian Twists?
82,Is it necessary to touch the floor with the medicine ball during each Medicine Ball Russian Twist repetition?
82,"If I don't have a medicine ball, what can I substitute to get a similar workout?"
83,How many sets and reps of Pendlay Rows should I perform for optimal muscle growth?
83,What is the proper grip width for Pendlay Rows to maximize Latissimus Dorsi activation?
83,Should my back be completely flat or slightly arched during the Pendlay Row exercise?
83,What are some common mistakes to avoid while performing Pendlay Rows to prevent injury?
83,How can I modify the Pendlay Row to accommodate my current strength level if I'm a beginner?
84,How many repetitions should I aim for on each side for optimal results?
84,Should I hold my breath during the leg lift or maintain consistent breathing?
84,What modifications can I make if I find the standard side plank too challenging?
84,Is it necessary to keep my body in a perfectly straight line throughout the exercise?
84,How can I prevent my lower back from arching during the leg lift?
85,How many sets and repetitions of hip abductions are recommended for building glute strength?
85,What is the proper starting position and the correct posture to maintain throughout the hip abduction exercise to avoid injury?
85,"Should I adjust the resistance on the hip abduction machine based on my fitness level, and how can I determine the appropriate weight?"
85,"Is there a risk of overtraining the glutes or hip flexors if I perform hip abductions too frequently, and what measures should I take to prevent this?"
85,"Are there any variations of the hip abduction exercise that can target specific gluteal muscles, such as the gluteus medius or gluteus maximus?"
86,How many sets and reps of Dumbbell Front Raises should I do for optimal deltoid growth?
86,"Should I use a lighter weight and focus on controlled movements for Dumbbell Front Raises, or go heavier with fewer reps?"
86,"Is it okay to slightly bend my elbows during the Dumbbell Front Raise exercise, or should they remain perfectly straight?"
86,"What is the ideal range of motion for the Dumbbell Front Raise, and how can I ensure I'm completing the full range?"
86,"Besides the deltoids, what other muscles are significantly engaged during Dumbbell Front Raises, and how can I avoid overworking them?"
87,How many chin-ups should I aim for as a beginner?
87,What variations of chin-ups can I do if I can't do a full chin-up yet?
87,Is it okay if my form isn't perfect when starting?
87,Should I focus on the negative (lowering) portion of the movement?
87,How can I progress from chin-ups to more advanced pull-up variations?
88,How low should my hips be relative to the box during a box squat?
88,What is the ideal box height for maximizing quadriceps activation during a box squat?
88,Should I prioritize a controlled descent or an explosive ascent during box squats?
88,Can I perform box squats with dumbbells instead of a barbell?
88,How does the width of my stance affect quadriceps and glute engagement during box squats?
89,How many repetitions or sets of Battle Rope Waves are recommended for optimal results?
89,What is the proper form to avoid injuries while performing Battle Rope Waves?
89,"Can I modify Battle Rope Waves to suit my current fitness level, and if so, how?"
89,"Besides Deltoids, Forearms, and Core, what other muscles are secondarily engaged during Battle Rope Waves?"
89,What are some alternative exercises that target similar muscle groups if I don't have access to battle ropes?
90,How much weight should I use for Zercher Squats when starting?
90,What is the proper hand and elbow placement to prevent injury during Zercher Squats?
90,Should my back remain straight throughout the entire Zercher Squat movement?
90,Is it okay if my thighs don't go completely parallel to the floor during Zercher Squats?
90,What are some common mistakes to avoid while performing Zercher Squats?
91,How far forward should my front foot be placed during each walking lunge?
91,"Should my front knee go beyond my toes while performing the walking lunge, and if not, how can I prevent that?"
91,What is the optimal step length to maintain proper form and balance throughout the walking lunge exercise?
91,How can I modify the walking lunge to make it easier if I am a beginner or have knee problems?
91,"Is it necessary to keep my core engaged throughout the entire walking lunge movement, and why?"
92,How many repetitions and sets of Kettlebell Snatches are recommended for building strength?
92,What is the proper grip technique for the Kettlebell Snatch to prevent injury?
92,Should I prioritize explosive power or controlled movements during the Kettlebell Snatch?
92,Are there variations of the Kettlebell Snatch suitable for beginners or those with limited mobility?
92,What are some common mistakes to avoid when performing Kettlebell Snatches to maximize effectiveness and prevent injury?
93,How many repetitions and sets of Single-Leg Glute Bridges should I do for optimal glute activation?
93,"Should my extended leg remain straight throughout the entire Single-Leg Glute Bridge exercise, or can I slightly bend it?"
93,Is it acceptable to use a resistance band during the Single-Leg Glute Bridge to increase the challenge?
93,What are the common mistakes to avoid while performing Single-Leg Glute Bridges to prevent injury and maximize results?
93,"Does the Single-Leg Glute Bridge primarily work one glute at a time, or does it also engage the opposite glute muscle?"
94,How do I adjust the TRX straps for proper form during TRX push-ups?
94,What modifications can I make to the TRX push-up if I'm a beginner and find standard push-ups too difficult?
94,"Besides pectorals, triceps, and deltoids, what other muscles are secondarily engaged during a TRX push-up?"
94,"Is it necessary to keep my body perfectly straight throughout the entire TRX push-up movement, or is a slight bend acceptable?"
94,"How many repetitions and sets of TRX push-ups should I aim for as a beginner, and how frequently should I perform this exercise?"
95,How many sets and reps of machine leg curls should I do to build hamstring strength?
95,What is the proper form to avoid injuring my knees during the machine leg curl exercise?
95,Should I use a heavier weight for fewer reps or a lighter weight for more reps when performing machine leg curls?
95,What are some alternative exercises I can do if the leg curl machine is unavailable?
95,Can I modify the machine leg curl exercise to accommodate a hamstring injury?
96,How many sets and reps of incline bench press are recommended for building upper chest muscle mass?
96,What is the optimal incline angle for maximizing pectoral activation during the incline bench press?
96,"Should I prioritize a slow, controlled descent or a fast descent during the lowering phase of the incline bench press?"
96,"Besides pectorals, triceps, and deltoids, what other muscles are secondarily activated during the incline bench press?"
96,What are some common mistakes to avoid when performing the incline bench press to prevent injury and maximize effectiveness?
97,How many sets and reps of Resistance Band Deadlifts should I do for optimal results?
97,"What level of resistance band should I use for this exercise, and how do I determine the correct resistance?"
97,Should my knees be slightly bent or straight during the Resistance Band Deadlift?
97,Where exactly should I position my feet relative to the resistance band for proper form and activation of target muscles?
97,"What are some common mistakes to avoid when performing Resistance Band Deadlifts, and how can I correct my form if needed?"
98,How many sets and reps of decline bench press are recommended for building muscle mass?
98,What is the proper grip width for the barbell during a decline bench press to maximize pectoral activation?
98,"Should I use a spotter when performing decline bench presses, especially with heavier weights?"
98,What are some common mistakes to avoid while doing decline bench presses to prevent injuries?
98,"Besides pectorals, triceps, and deltoids, what other muscles are secondarily activated during decline bench presses?"
99,How many repetitions and sets of Dumbbell Step-Ups should I do for optimal glute activation?
99,What is the ideal height of the bench for proper form during Dumbbell Step-Ups?
99,Should I keep my dumbbells close to my body or extended out during the Dumbbell Step-Up exercise?
99,"Can I substitute the dumbbells with another form of weight, like kettlebells, while maintaining the same muscle activation?"
99,"If I experience knee pain during Dumbbell Step-Ups, what modifications can I make to improve my form and reduce discomfort?"
100,How many sets and reps of Cable Lateral Raises should I do for optimal shoulder growth?
100,"Should I use a straight or rope attachment for the Cable Lateral Raises, and why?"
100,What is the ideal weight to use for Cable Lateral Raises to ensure proper form and muscle engagement without compromising technique?
100,"Is it important to keep my elbows slightly bent during the Cable Lateral Raise exercise, and if so, why?"
100,"Besides the Deltoids, what other muscles are indirectly activated during Cable Lateral Raises?"
101,How far back should my rear leg step for a proper Reverse Lunge?
101,Should my front knee track over my ankle during the Reverse Lunge?
101,What should I do if I feel pain in my knees while performing Reverse Lunges?
101,Is it okay to use dumbbells or other weights for Reverse Lunges to increase difficulty?
101,"How many Reverse Lunges should I do per set for optimal results, considering I'm a beginner?"
102,How many repetitions of toe touches should I aim for during a workout?
102,Should I keep my legs straight or slightly bent during the toe touch movement?
102,What is the proper breathing technique while performing toe touches?
102,"Is it okay to modify the exercise if I can't reach my toes, and if so, how?"
102,What other core exercises can I combine with toe touches for a balanced workout?
103,How many sets and reps of Machine Leg Extensions should I do for optimal quadriceps growth?
103,What is the proper weight to use on the Machine Leg Extension to avoid injury and ensure effective training?
103,"Should I lock my knees completely at the top of the Machine Leg Extension movement, or is there a better range of motion?"
103,What are some common mistakes to avoid when performing the Machine Leg Extension exercise to prevent injury or plateau?
103,Can I substitute any free weight exercises for the Machine Leg Extension to target the same muscle groups?
104,How many repetitions and sets should I do for optimal Latissimus Dorsi engagement during Dumbbell Pullovers?
104,What is the proper grip technique to avoid strain on my wrists while performing Dumbbell Pullovers?
104,Should my elbows be slightly bent or fully extended throughout the Dumbbell Pullover movement?
104,"Besides the Latissimus Dorsi, Pectorals, and Triceps, what other muscles are secondarily activated during Dumbbell Pullovers?"
104,Can I substitute the bench with an exercise ball to increase the challenge and core activation during Dumbbell Pullovers?
105,How many sets and reps of barbell shrugs should I do for optimal trapezius growth?
105,What is the proper grip width for a barbell shrug to maximize muscle activation?
105,Should I use a straight bar or a curved (EZ) bar for this exercise?
105,"Is it okay to slightly arch my back during the shrug movement, or should it remain straight?"
105,What are some common mistakes to avoid when performing barbell shrugs to prevent injury?
106,How many sets and reps of T-Bar Rows should I do for optimal muscle growth?
106,"What is the proper grip width to use when performing a T-Bar Row, and how does it affect the muscles worked?"
106,Should my back be straight or slightly arched during the T-Bar Row exercise to prevent injury?
106,"Besides the Latissimus Dorsi and Biceps, what other secondary muscle groups are significantly activated during the T-Bar Row?"
